ID, SPRINT_ID, EMPLOYEE_ID, DATE, RATING, COMMENT
1, 1, 1, 2024-07-07, 8, "Sprint 1 was a great sprint. We were able to complete all the stories and the team is working well together."
2, 1, 2, 2024-07-07, 6, "We had a few issues with the database, but we were able to resolve them quickly."
3, 1, 3, 2024-07-07, 7, "I'm happy with the progress we made this sprint. Looking forward to the next one."
4, 2, 1, 2024-07-14, 9, "Sprint 2 was another successful sprint. We were able to complete all the stories and the team is working well together."
5, 2, 2, 2024-07-14, 6, "This sprint was challenging, but we were able to overcome the obstacles and deliver on time."
6, 2, 3, 2024-07-14, 10, "I'm proud of the team's performance this sprint. We worked well together and delivered quality work."
